Physical,Horizon,SOUNDDISC,2018,6,4,John Williams greatest hits. 1969-1999.,"Williams, John, 1932-","Motion picture music Excerpts, Orchestral music, Instrumental music","Sony Classical,",[1999]
Physical,Horizon,BOOK,2018,6,4,The hero and the crown / Robin McKinley.,"McKinley, Robin","Fantasy, Fantasy fiction","Firebird,",[2002]
Digital,OverDrive,EBOOK,2018,6,1,"His Sinful Secret: Notorious Bachelors Series, Book 3",Emma Wildes,"Fiction, Historical Fiction, Romance","Penguin Group (USA), Inc.",2011
Digital,OverDrive,EBOOK,2018,6,2,"Excalibur: The Warlord Chronicles, Book 3",Bernard Cornwell,"Fantasy, Fiction, Historical Fiction",Macmillan Publishers,2013
Physical,Horizon,BOOK,2018,6,1,Starlight nights / Stacey Kade.,"Kade, Stacey","Actors Fiction, Recovering addicts Fiction, College students Fiction, Man woman relationships Fiction, Romance fiction","Forge,",2018.
Physical,Horizon,BOOK,2018,6,1,"Dictionary of the Khazars : a lexicon novel in 100,000 words / Milorad Pavić ; translated from the Serbo-Croatian by Christina Pribićević-Zorić.","Pavić, Milorad",Khazars Fiction,"Vintage Books,",1989.
Physical,Horizon,BOOK,2018,6,8,The forest feast for kids : colorful vegetarian recipes that are simple to make / Erin Gleeson.,"Gleeson, Erin","Vegetarian cooking Juvenile literature, Cookbooks","Abrams Books for Young Readers,",[2016]
Physical,Horizon,BOOK,2018,6,1,This old boat / Don Casey.,"Casey, Don","Boats and boating Maintenance and repair, Fiberglass boats Maintenance and repair","International Marine/McGraw-Hill,",[2009]
Digital,OverDrive,EBOOK,2018,6,2,Investing: The Last Liberal Art,Robert G. Hagstrom,"Business, Nonfiction",Lightning Source Inc,2013
Digital,OverDrive,EBOOK,2018,6,1,The Stepsister Scheme,Jim C. Hines,"Fantasy, Fiction","Penguin Group (USA), Inc.",2013
Digital,OverDrive,EBOOK,2018,6,2,The Best Buddhist Writing 2010,Melvin McLeod,"Nonfiction, Religion & Spirituality","Random House, Inc.",2011
Physical,Horizon,SOUNDDISC,2018,6,1,Wake up now / Nick Mulvey.,"Mulvey, Nick","Popular music 2011 2020, Popular music","Fiction Records,",[2017]
Physical,Horizon,BOOK,2018,6,25,Ocean of color / by Bill Scollon ; illustrated by the Disney Storybook Art Team.,"Scollon, Bill","Fishes Juvenile fiction, Marine animals Juvenile fiction, Adventure and adventurers Fiction, Adventure stories","Random House,",[2016]
Physical,Horizon,BOOK,2018,6,1,A single man / Christopher Isherwood.,"Isherwood, Christopher, 1904-1986","Loss Psychology Fiction, Middle aged men Fiction, Gay men Fiction, Grief Fiction, Psychological fiction","University of Minnesota Press,",2001.
Physical,Horizon,BOOK,2018,6,1,Weather / written by Brian Cosgrove.,"Cosgrove, Brian, 1926-","Weather Juvenile literature, Climatology Juvenile literature, Atmosphere Juvenile literature","DK Pub.,",2007.
Physical,Horizon,SOUNDDISC,2018,6,1,"Gus & me : the story of my granddad and my first guitar / Keith Richards, with Barnaby Harris and Bill Shapiro ; art by Theodora Richards.","Richards, Keith, 1943-","Richards Keith 1943 Juvenile literature, Richards Keith 1943 Family Juvenile literature, Grandparent and child Juvenile literature, Grandfathers Juvenile literature, Musical instruments Juvenile literature, Picture books","Little, Brown and Company,",2014.
Physical,Horizon,SOUNDDISC,2018,6,1,The raven / Lou Reed.,"Reed, Lou",Rock music 2001 2010,"Sire/Reprise,",[2003]
Physical,Horizon,BOOK,2018,6,3,Jenny's moonlight adventure / story and pictures by Esther Averill.,"Averill, Esther, 1902-1992","Cats Juvenile fiction, Halloween Juvenile fiction, Courage Juvenile fiction","New York Review of Books,",2005.
Physical,Horizon,BOOK,2018,6,2,Rectangles / Teddy Borth.,"Borth, Teddy","Rectangles Juvenile literature, Geometry Juvenile literature, Shapes Juvenile literature","ABDO Kids, a division of ABDO Publishing Company,",[2016]
Physical,Horizon,BOOK,2018,6,1,The Dark Lord / Jack Heckel.,"Heckel, Jack","Wizards Fiction, Magic Fiction, Good and evil Fiction, Fantasy fiction","Harper Voyager Impulse, an imprint of HarperCollins Publishers,",2016.
Digital,OverDrive,AUDIOBOOK,2018,6,2,"Hot, Flat, and Crowded: Why We Need a Green Revolution—and How It Can Renew America (unabridged) (Unabridged)",Thomas L. Friedman,"Business, Nonfiction, Politics",Macmillan Audio,2008
Digital,OverDrive,AUDIOBOOK,2018,6,3,Betaball: How Silicon Valley and Science Built One of the Greatest Basketball Teams in History (unabridged) (Unabridged),Erik Malinowski,"Nonfiction, Sports & Recreations",Simon & Schuster - All Library,2017
Physical,Horizon,BOOK,2018,6,2,"Live fearless : a call to power, passion, and purpose / Sadie Robertson, with Beth Clark ; foreword by Louie Giglio.","Robertson, Sadie, 1997-","Christian life, Fear Religious aspects Christianity, Teenage girls Religious life, Christian teenagers Religious life","Thomas Nelson,",[2018]
Physical,Horizon,BOOK,2018,6,2,Don't sweat the small stuff-- and it's all small stuff : simple ways to keep the little things from taking over your life / Richard Carlson.,"Carlson, Richard, 1961-2006","Behavior modification, Conduct of life, Peace of mind","Hachette Books,",2017.
Digital,OverDrive,AUDIOBOOK,2018,6,1,The Snowy Day (Unabridged),Ezra Jack Keats,"Juvenile Fiction, Juvenile Literature",Live Oak Media,2013
Physical,Horizon,BOOK,2018,6,1,The soul of the Indian / Charles Alexander Eastman (Ohiyesa).,"Eastman, Charles A., 1858-1939","Indians of North America Religion, Indian mythology North America, Indian philosophy North America","Dover Publications,",2003.
Digital,OverDrive,EBOOK,2018,6,1,Icy Sparks,Gwyn Hyman Rubio,"Fiction, Literature","Penguin Group (USA), Inc.",2009
Physical,Horizon,VIDEODISC,2018,6,3,Irma Vep / Zeitgeist Films ; Dacia Films avec la participation de Canal + ; produit par Georges Benayoun ; écrit et réalise par Olivier Assayas.,,"Motion picture industry France Drama, Visitors Foreign Drama, Actresses Drama, Motion picture actors and actresses China Hong Kong Drama, Motion picture producers and directors France Drama, Feature films, Fiction films, Motion pictures French, Video recordings for the hearing impaired","Zeitgeist Video,",2008.
Physical,Horizon,BOOK,2018,6,1,"Homemade living. Canning & preserving with Ashley English : all you need to know to make jams, jellies, pickles, chutneys & more.","English, Ashley, 1976-","Canning and preserving, Food Preservation","Lark Books,",[2010]
Physical,Horizon,BOOK,2018,6,1,Bob Dylan by Greil Marcus : writings 1968-2010.,"Marcus, Greil","Dylan Bob 1941, Singers United States History and criticism","Public Affairs,",[2010]
Physical,Horizon,VIDEODISC,2018,6,5,Hammer films : 4 creepy classics from the Hammer Films archives / Columbia Pictures Corporation ; a Hammer Film production.,,"Jekyll Henry Fictitious character Drama, Mummies Drama, Tombs Desecration Drama, Monsters Drama, Medusa Greek mythology Drama, Gorgons Greek mythology Drama, Paraplegics Drama, Dead Drama, Feature films, Horror films, Fiction films, Video recordings for the hearing impaired","Sony Pictures Home Entertainment,",[2008]
Digital,OverDrive,EBOOK,2018,6,1,Horrid Henry and the Zombie Vampire,Francesca Simon,"Humor (Fiction), Juvenile Fiction",Sourcebooks,2012
Physical,Horizon,BOOK,2018,6,2,"Out of our heads : why you are not your brain, and other lessons from the biology of consciousness / Alva Noë.","Noë, Alva",Consciousness,"Hill and Wang,",2009.
Physical,Horizon,BOOK,2018,6,1,Overcoming binge eating : the proven program to learn why you binge and how you can stop / Dr. Christopher G. Fairburn.,"Fairburn, Christopher G.",Compulsive eating Popular works,"The Guilford Press,",[2013]
Physical,Horizon,BOOK,2018,6,1,The Goths / Peter Heather.,"Heather, P. J. (Peter J.)",Goths History,"Blackwell Publishers,",1996.
Digital,OverDrive,AUDIOBOOK,2018,6,1,"Magic in the Wind: Sea Haven: Drake Sisters Series, Book 1 (unabridged) (Unabridged)",Christine Feehan,"Fantasy, Fiction, Romance",Books on Tape,2009
Digital,OverDrive,AUDIOBOOK,2018,6,8,"The Shepherd's Crown: Discworld Series, Book 41 (unabridged) (Unabridged)",Terry Pratchett,"Fantasy, Young Adult Fiction",HarperCollins Publishers Inc.,2015
Physical,Horizon,BOOK,2018,6,1,Mariel of Redwall / Brian Jacques ; [illustrations by Gary Chalk].,"Jacques, Brian","Mice Juvenile fiction, Animals Juvenile fiction, Fantasy","Ace Books,",2000.
Physical,Horizon,BOOK,2018,6,1,Skybreaker / Kenneth Oppel.,"Oppel, Kenneth, 1967-","Airships Juvenile fiction, Salvage Juvenile fiction, Pirates Juvenile fiction, Imaginary creatures Fiction, Inventions Juvenile fiction, Animals Mythical Juvenile fiction","Eos,",2007.
Physical,Horizon,BOOK,2018,6,1,The closing of the liberal mind : how groupthink and intolerance define the left / Kim R. Holmes.,"Holmes, Kim R.","Liberalism United States, Freedom of speech United States, Political correctness United States, Toleration United States, Right and left Political science","Encounter Books,",[2016]
Physical,Horizon,BOOK,2018,6,1,Tales of famous Americans / Connie and Peter Roop ; illustrations by Charlie Powell.,"Roop, Connie","Celebrities United States Biography Juvenile literature, Celebrities United States Juvenile literature, United States Biography Juvenile literature","Scholastic Reference,",[2007]
Digital,OverDrive,AUDIOBOOK,2018,6,8,Smash Cut (Unabridged),Sandra Brown,"Fiction, Suspense","Recorded Books, LLC",2017
Physical,Horizon,BOOK,2018,6,2,Which puppy? / Kate Feiffer ; illustrated by Jules Feiffer.,"Feiffer, Kate","White House Washington D C Juvenile fiction, Dogs Fiction, Animals Infancy Juvenile fiction, African Americans Juvenile fiction, Humorous stories","Simon & Schuster Books for Young Readers,",[2009]
Digital,OverDrive,EBOOK,2018,6,1,"The Naked Brain: How the Emerging Neurosociety is Changing How We Live, Work, and Love","Richard Restak, M.D.","Nonfiction, Science, Sociology","Random House, Inc.",2009
Physical,Horizon,BOOK,2018,6,4,Making an impression : designing & creating artful stamps / Geninne D. Zlatkis.,"Zlatkis, Geninne D.","Rubber stamp printing, Rubber stamp art","Lark Crafts,",[2012]
Physical,Horizon,BOOK,2018,6,2,The massacre of mankind : sequel to The war of the worlds / Stephen Baxter.,"Baxter, Stephen","Imaginary wars and battles Fiction, Space warfare Fiction, Mars Planet Fiction, War fiction, Science fiction","Crown, an imprint of the Crown Publishing Group,",[2017]
Physical,Horizon,VIDEODISC,2018,6,1,It's always sunny in Philadelphia. The complete season 7 / FX Productions.,,"Bars Drinking establishments Management Drama, Irish Americans Pennsylvania Philadelphia Drama, Philadelphia Pa Drama, Television series, Fiction television programs, Video recordings for the hearing impaired, Television comedies","20th Century Fox Home Entertainment,",2012.
Digital,OverDrive,AUDIOBOOK,2018,6,1,Walking with God: Talk to Him. Hear from Him. Really. (unabridged) (Unabridged),John Eldredge,"Nonfiction, Religion & Spirituality",Thomas Nelson Inc.,2013
Physical,Horizon,BOOK,2018,6,10,Phoebe sounds it out / written by Julie Zwillich ; illustrated by Denise Holmes.,"Zwillich, Julie","School children Juvenile fiction, Spelling errors Juvenile fiction, Writing Juvenile fiction, English language Phonetics Juvenile fiction, Schools Fiction, Picture books","Owlkids Books,",[2017]
Physical,Horizon,BOOK,2018,6,1,The brownstone / story by Paula Scher ; pictures by Stan Mack.,"Scher, Paula","Apartment houses Fiction, Individuality Fiction, Animals Fiction, City and town life Fiction","Princeton Architectural Press,",2015.
Digital,OverDrive,AUDIOBOOK,2018,6,3,Teaching a Stone to Talk: Expeditions and Encounters (unabridged) (Unabridged),Annie Dillard,"Literary Criticism, Nonfiction","Tantor Media, Inc",2016
Physical,Horizon,BOOK,2018,6,1,"How to protect your family's assets from devastating nursing home costs : Medicaid secrets / K. Gabriel Heiser, Attorney.","Heiser, K. Gabriel","Medicaid beneficiaries United States Finance Personal, Nursing homes Rates United States, Medicaid beneficiaries Legal status laws etc United States, Medicaid Law and legislation","Phylius Press,",[2016]
Physical,Horizon,BOOK,2018,6,2,One wild bird at a time : portraits of individual lives / Bernd Heinrich.,"Heinrich, Bernd, 1940-",Birds Maine Anecdotes,"Houghton Mifflin Harcourt,",2016.
Digital,OverDrive,EBOOK,2018,6,1,"Treasury of Norse Mythology: Stories of Intrigue, Trickery, Love, and Revenge",Donna Jo Napoli,"History, Juvenile Nonfiction","Random House, Inc.",2015
Physical,Horizon,BOOK,2018,6,15,"The legend of Zelda. Oracle of Seasons ; Oracle of Ages / story and art by Akira Himekawa ; [translation John Werry, Honyaku Center, Inc. ; English adaptation, Steven ""Stan!"" Brown ; lettering, John Hunt].","Himekawa, Akira","Legend of Zelda Game Comic books strips etc, Heroes Comic books strips etc, Voyages and travels Comic books strips etc, Adventure and adventure Comic books strips etc, Cartoons and comics, Graphic novels, Fantasy comics, Action and adventure comics","Viz Media, LLC,",[2017]
Physical,Horizon,VIDEODISC,2018,6,1,"Sweet sweetback's baadasssss song / written, produced, directed by Melvin van Peebles ; a Yeah production.",,"African Americans Drama, Police brutality Drama, Racism Drama, Feature films","Xenon Pictures,",2002.
Digital,OverDrive,EBOOK,2018,6,2,Double Indemnity,James M. Cain,"Classic Literature, Fiction, Mystery","Random House, Inc.",2011
Physical,Horizon,SOUNDDISC,2018,6,1,"Saving capitalism : [for the many, not the few] / by Robert B. Reich.","Reich, Robert B.","Capitalism United States, Democracy Economic aspects United States, Income distribution United States, Audiobooks","Recorded Books,",[2015]
Digital,OverDrive,AUDIOBOOK,2018,6,6,"The Moor: Mary Russell and Sherlock Holmes Series, Book 4 (unabridged) (Unabridged)",Laurie R. King,"Fiction, Historical Fiction, Mystery",Macmillan Audio,2016
Digital,OverDrive,EBOOK,2018,6,1,"The Shadow Cadets of Pennyroyal Academy: Pennyroyal Academy Series, Book 2",M. A. Larson,"Fantasy, Juvenile Fiction","Penguin Group (USA), Inc.",2016
Digital,OverDrive,EBOOK,2018,6,1,"Larkspur Cove: Moses Lake Series, Book 1",Lisa Wingate,"Christian Fiction, Fiction, Romance",Baker Publishing Group,2011
Digital,OverDrive,AUDIOBOOK,2018,6,1,"20,000 Days and Counting: The Crash Course For Mastering Your Life Right Now (unabridged) (Unabridged)",Robert D. Smith,"Nonfiction, Self-Improvement",Thomas Nelson Inc.,2013
Digital,OverDrive,EBOOK,2018,6,7,"The Heiress Effect: Brothers Sinister Series, Book 2",Courtney Milan,"Fiction, Historical Fiction, Romance",NLA Digital LLC,2014
Physical,Horizon,SOUNDDISC,2018,6,2,Black / Dierks Bentley.,"Bentley, Dierks","Country music 2011 2020, Country music","Capitol Nashville,",[2016]
Digital,OverDrive,AUDIOBOOK,2018,6,18,Jonathan Strange & Mr. Norrell: A Novel (unabridged) (Unabridged),Susanna Clarke,"Fantasy, Fiction, Historical Fiction",Macmillan Audio,2006
Digital,OverDrive,AUDIOBOOK,2018,6,2,It's Kind of a Funny Story (Unabridged),Ned Vizzini,"Young Adult Fiction, Young Adult Literature","Tantor Media, Inc",2017
Physical,Horizon,BOOK,2018,6,1,"Blue ribbon canning : award-winning recipes ; jams, preserves, pickles, sauces & more / Linda J. Amendt.","Amendt, Linda J.","Canning and preserving, Cookbooks","The Taunton Press, Inc.,",[2015]
Digital,OverDrive,AUDIOBOOK,2018,6,1,"Horrible Harry and the Missing Diamond: Horrible Harry Series, Book 30 (unabridged) (Unabridged)",Suzy Kline,"Juvenile Fiction, Juvenile Literature","Recorded Books, LLC",2018
Physical,Horizon,VIDEODISC,2018,6,27,"Steve Jobs / Universal Pictures ; Legendary Pictures ; a Scott Rudin/Entertainment 360/Mark Gordon Company production ; a Decibel Films/Cloud Eight Films production ; produced by Mark Gordon, Guymon Casady, Scott Rudin, Danny Boyle, Christian Colson ; screenplay by Aaron Sorkin ; directed by Danny Boyle.",,"Jobs Steve 1955 2011 Drama, Apple Computer Inc History Drama, Computer engineers Drama, Businesspeople Drama, Computer industry Drama, Biographical films, Fiction films, Feature films, Video recordings for the hearing impaired, Video recordings for people with visual disabilities","Universal Studios Home Entertainment,",[2016]
Physical,Horizon,BOOK,2018,6,6,The liars' gospel : a novel / Naomi Alderman.,"Alderman, Naomi","Jesus Christ Fiction, Dictators Fiction, Historical fiction","Back Bay Books : Little, Brown and Co.,",2014.
Physical,Horizon,SOUNDDISC,2018,6,1,The grace of Kings / Ken Liu.,"Liu, Ken, 1976-","Revolutions Fiction, Friendship Fiction, Audiobooks, Fantasy fiction","Simon & Schuster Audio,",[2015]
Digital,OverDrive,EBOOK,2018,6,2,The Further Investigations of Joanne Kilbourn,Gail Bowen,"Fiction, Mystery","Random House, Inc.",2012
Physical,Horizon,BOOK,2018,6,1,"The West Point History of World War II. Volume 2 / The United States Military Academy ; foreword by Henry A. Kissinger ; editors, Clifford J. Rogers, Ty Seidule, and Steve R. Waddell.",,World War 1939 1945,"Simon & Schuster,",2016
Physical,Horizon,SOUNDDISC,2018,6,3,Live at the Fillmore East 1968 / the Who.,Who (Musical group),"Rock music 1961 1970, Rock music","Geffen,",[2018]
Physical,Horizon,BOOK,2018,6,2,Shackleton's journey / William Grill.,"Grill, William","Shackleton Ernest Henry Sir 1874 1922 Juvenile literature, Explorers Great Britain Biography Juvenile literature, Antarctica Discovery and exploration British Juvenile literature, Picture books","Flying Eye Books,",[2014]
Physical,Horizon,VIDEODISC,2018,6,2,Convoy / Metro Goldwyn Mayer ; United Artists ; EMI ; produced by Robert M. Sherman ; directed by Sam Peckinpah ; screen story and screenplay by B.W.L. Norton.,,"Truck drivers Drama, Police Drama, Man woman relationships Drama, Action and adventure films, Road films, Feature films, Fiction films","Kino Lorber, Inc.,",[2015?]
Digital,OverDrive,EBOOK,2018,6,3,"The Day the World Came to Town: 9/11 in Gander, Newfoundland",Jim DeFede,"History, Nonfiction",HarperCollins Publishers Inc.,2015
Physical,Horizon,BOOK,2018,6,11,Three's a crowd! / by Ray O'Ryan ; illustrated by Colin Jack.,"O'Ryan, Ray","Science fiction Juvenile fiction, Human alien encounters Juvenile fiction, Best friends Juvenile fiction, Friendship Juvenile fiction","Little Simon,",[2013]
Digital,OverDrive,EBOOK,2018,6,3,Eating in the Middle: A Mostly Wholesome Cookbook,Andie Mitchell,"Cooking & Food, Nonfiction","Random House, Inc.",2016
Physical,Horizon,BOOK,2018,6,1,"Martin, Malysh i Govor︠i︡ashcha︠i︡a Kniga : istori︠i︡a staroĭ biblioteki / Ann Zhonas, khudozhnik, Fransua Kroza ; perevod s Fran︠t︡s uzskogo, I. Bokovoĭ.","Jonas, Anne","Cats Juvenile fiction, Mice Juvenile fiction, Books and reading Juvenile fiction, Russian language materials","Enas-Kniga,",2014.
Physical,Horizon,VIDEODISC,2018,6,2,"Click, clack, peep! / Dreamscape ; written by Doreen Cronin ; illustrated by Betsy Lewin ; produced by Ryan Swenar.",,"Domestic animals Juvenile films, Ducks Juvenile films, Animals Infancy Juvenile films, Sleep Juvenile films, Short films, Childrens films, Animated films, Fiction films","Dreamscape Media,",[2017]
Physical,Horizon,BOOK,2018,6,2,Minty : a story of young Harriet Tubman / by Alan Schroeder ; pictures by Jerry Pinkney.,"Schroeder, Alan","Tubman Harriet 1820 1913 Juvenile literature, Tubman Harriet 1820 1913 Childhood and youth Juvenile literature, Slaves United States Biography Juvenile literature, Antislavery movements United States Juvenile literature, African Americans Biography Juvenile literature, Underground Railroad Juvenile literature","Puffin Books,",2000.
Physical,Horizon,BOOK,2018,6,1,"Rescued : what second-chance dogs teach us about living with purpose, loving with abandon, and finding joy in the little things / Peter Zheutlin.","Zheutlin, Peter","Dogs, Dog rescue, Human animal relationships","TarcherPerigee,",2017.
Physical,Horizon,BOOK,2018,6,1,Amulet snezhnogo cheloveka / Natalʹ︠i︡a Aleksandrova.,"Aleksandrova, N. (Natalʹ︠i︡a)",Yeti Fiction,"ĖKSMO,",2015.
Physical,Horizon,BOOK,2018,6,6,Growing a revolution : bringing our soil back to life / David R. Montgomery.,"Montgomery, David R., 1961-","Soil ecology, Soil biology, Soil restoration","W.W. Norton & Company,",[2017]
Physical,Horizon,BOOK,2018,6,1,Gossip girl / a novel by Cecily von Ziegesar.,"Von Ziegesar, Cecily","Teenagers Fiction, Gossip Fiction, Online chat groups Fiction","Little, Brown,",[2002]
Physical,Horizon,BOOK,2018,6,1,Tiger's curse / by Colleen Houck.,"Houck, Colleen","Tiger Juvenile fiction, Blessing and cursing Juvenile fiction, Immortality Fiction, Orphans Juvenile fiction, Circus Fiction, India Juvenile fiction","Splinter,",[2012]
Physical,Horizon,VIDEODISC,2018,6,2,Full house. The complete eighth season / Warner Bros. Television ; Jeff Franklin Productions and Miller-Boyett Productions in association with Lorimar-Television.,,"Fathers and daughters Juvenile drama, Motherless families Juvenile drama, Girls Juvenile drama, Families Juvenile drama, Television comedies, Television series, Childrens television programs, Fiction television programs, Television programs for the hearing impaired","Distributed by Warner Home Video,",[2007]
Physical,Horizon,SOUNDDISC,2018,6,9,V. / Wooden Shjips.,Wooden Shjips (Musical group),"Rock music 2011 2020, Rock music","Thrill Jockey Records,",[2018]
Physical,Horizon,VIDEODISC,2018,6,13,PJ Masks. Save the summer / Frog Box ; Entertainment One ; Walt Disney EMEA Productions Limited.,,"Superheroes Juvenile drama, Friendship Juvenile drama, Cooperativeness Juvenile drama, Summer Juvenile drama, Television series, Childrens television programs, Animated television programs, Action and adventure television programs, Fiction television programs, Video recordings for the hearing impaired","Twentieth Century Fox Home Entertainment,",[2018]
Digital,OverDrive,EBOOK,2018,6,1,Maisy's Field Day,Lucy Cousins,"Juvenile Fiction, Juvenile Literature, Picture Book Fiction",Candlewick Press,2017
Digital,OverDrive,EBOOK,2018,6,1,"The Double Wedding Ring: Someday Quilts Mystery Series, Book 5",Clare O'Donohue,"Fiction, Mystery","Penguin Group (USA), Inc.",2013
Physical,Horizon,BOOK,2018,6,1,"The Upright Citizens Brigade comedy improvisation manual / Matt Besser, Ian Roberts and Matt Walsh.","Besser, Matt, 1967-","Comedy Technique, Improvisation Acting Technique, Comedy sketches Technique","Comedy Council of Nicea, LLC,",2013.
Digital,OverDrive,AUDIOBOOK,2018,6,3,"The Killing Dance: Anita Blake, Vampire Hunter Series, Book 6 (unabridged) (Unabridged)",Laurell K. Hamilton,"Fantasy, Fiction, Romance",Books on Tape,2010
Physical,Horizon,BOOK,2018,6,2,Noni is nervous / Heather Hartt-Sussman ; illustrated by Geneviève Côté.,"Hartt-Sussman, Heather","First day of school Juvenile fiction, Schools Fiction, Anxiety Juvenile fiction","Tundra Books,",[2013]
Physical,Horizon,BOOK,2018,6,3,A dark so deadly / Stuart MacBride.,"MacBride, Stuart","Police Scotland Fiction, Murder Investigation Fiction, Scotland Fiction, Mystery fiction, Detective and mystery fiction","HarperCollins,",2017.
Physical,Horizon,BOOK,2018,6,1,General Crook and the western frontier / by Charles M. Robinson III.,"Robinson, Charles M., 1949-","Crook George 1829 1890, Indians of North America Wars 1866 1895, Generals United States Biography","University of Oklahoma Press,",[2001]
Physical,Horizon,BOOK,2018,6,1,Sitting Bull : great Sioux hero / George E. Stanley.,"Stanley, George Edward","Sitting Bull 1831 1890 Juvenile literature, Dakota Indians Biography Juvenile literature, Hunkpapa Indians Biography Juvenile literature, Little Bighorn Battle of the Mont 1876 Juvenile literature, Dakota Indians Juvenile literature, Hunkpapa Indians Juvenile literature","Sterling,",2010.
Digital,OverDrive,EBOOK,2018,6,3,More Than This,Patrick Ness,"Science Fiction & Fantasy, Young Adult Fiction, Young Adult Literature",Candlewick Press,2013
Digital,OverDrive,EBOOK,2018,6,5,Kevin Hearne's The Iron Druid Chronicles 3-Book Bundle: Hounded; Hexed; Hammered,Kevin Hearne,"Fantasy, Fiction, Thriller","Random House, Inc.",2012
Digital,OverDrive,EBOOK,2018,6,2,The Ionian Mission (Volume Book 8)  (Aubrey/Maturin Novels),Patrick O'Brian,"Fantasy, Fiction",W. W. Norton & Company,2015
Physical,Horizon,VIDEODISC,2018,6,2,"Karen llora en un bus = Karen cries on the bus / Cajanegra Producciones ; Schweizen ; Viva TV ; en asocio con Ciclope Films, Producciones El Paso ; con el apoyo del Fondo Para el Desarrollo Cinematografico Colombia ; producida por Alejandro Prieto ; una pelicula escrita y dirigida por Gabriel Rojas Vera.",,"Female friendship Drama, Self realization Drama, Janitors Drama, Colombia Drama, Feature films, Fiction films, Motion pictures Spanish, Video recordings for the hearing impaired","Film Movement,",2011.
Digital,OverDrive,EBOOK,2018,6,1,The Vegetables We Eat,Gail Gibbons,"Juvenile Nonfiction, Picture Book Nonfiction, Science",Holiday House,2015
Physical,Horizon,BOOK,2018,6,10,The alchemyst : the secrets of the immortal Nicholas Flamel / Michael Scott.,"Scott, Michael, 1959-","Flamel Nicolas 1418 Juvenile fiction, Dee John 1527 1608 Juvenile fiction, Alchemists Juvenile fiction, Magic Juvenile fiction, Brothers and sisters Juvenile fiction, Twins Juvenile fiction, San Francisco Calif Juvenile fiction, Occult fiction, Paranormal fiction","Delacorte Press,",[2007]
Digital,OverDrive,AUDIOBOOK,2018,6,2,Children of Jihad: A Young American's Travels among the Youth of the Middle East (unabridged) (Unabridged),Jared Cohen,"Biography & Autobiography, Nonfiction, Sociology, Travel","Blackstone Audio, Inc.",2007
Physical,Horizon,BOOK,2018,6,1,The river knows / Amanda Quick.,"Quick, Amanda","Women booksellers Fiction, Antiquarian booksellers England London Fiction, Suicide Fiction, London England Fiction, Historical fiction, Romantic suspense fiction","G.P. Putnam's Sons,",[2007]
