Physical,Horizon,VIDEODISC,2018,6,61,"The Lego Batman movie / Warner Bros. Pictures ; Warner Animation Group ; DC ; Ratpac Entertainment ; in association with Lego System A/S ; a Lin Pictures /Lord Miller/Vertigo Entertainment production ; directed by Chris McKay ; produced by Dan Lin, Phil Lord, Christopher Miller, Roy Lee ; screenplay by Seth Grahame-Smith ... [and others] ; story by Seth Grahame-Smith.",,"Batman Fictitious character Juvenile drama, Joker Fictitious character Juvenile drama, LEGO toys Juvenile drama, Feature films, Animated films, Action and adventure films, Childrens films, Comedy films, Superhero films, Video recordings for people with visual disabilities, Video recordings for the hearing impaired, Fiction films","Warner Home Video,",[2017]
Physical,Horizon,BOOK,2018,6,1,"Longman diccionario pocket : Inglés-Español, Español-Inglés : para estudiantes Latinoamericanos.",,"English language Dictionaries Spanish, Spanish language Dictionaries English","Longman,",2003.
Physical,Horizon,BOOK,2018,6,1,The boy in number four / by Kara Kootstra ; illustrated by Regan Thomson ; with an afterword by Bobby Orr.,"Kootstra, Kara","Orr Bobby 1948 Childhood and youth, Hockey, Stories in rhyme","Dial Books for Young Readers, an imprint of Penguin Group (USA) LLC,",[2014]
Physical,Horizon,BOOK,2018,6,2,Dinner / César Aira ; translation by Katherine Silver.,"Aira, César, 1949-",,"New Directions Books,",2015.
Physical,Horizon,VIDEODISC,2018,6,1,Man of Tai Chi / Radius-TWC ; Universal Pictures ; Village Roadshow Pictures Asia ; China Film Co. Ltd. ; Wanda Media ; in association with Company Films ; produced by Lemore Syvan ; written by Michael G. Cooney ; directed by Keanu Reeves.,,"Martial arts Drama, Hong Kong China Drama, Feature films, Martial arts films, Fiction films, Action and adventure films, Motion pictures Chinese, Video recordings for the hearing impaired","Anchor Bay Entertainment,",[2013]
Physical,Horizon,BOOK,2018,6,1,Bill and Pete / story and pictures by Tomie de Paola.,"DePaola, Tomie, 1934-","Crocodiles Juvenile fiction, Plovers Juvenile fiction, Birds Juvenile fiction","PaperStar,",1996.
Physical,Horizon,BOOK,2018,6,4,Better than you / by Trudy Ludwig ; illustrated by Adam Gustavson.,"Ludwig, Trudy","Pride and vanity Juvenile fiction, Self esteem Juvenile fiction, Friendship Fiction, Interpersonal relations Juvenile fiction","Alfred A. Knopf,",2011.
Physical,Horizon,BOOK,2018,6,1,Real collaboration : what it takes for global health to succeed / Mark L. Rosenberg ... [and others] ; with a preface by William H. Foege.,,"World health, Charities Medical, International cooperation, Medical policy","University of California Press,",[2010]
Physical,Horizon,BOOK,2018,6,3,"Hocus pocus, it's fall! / by Anne Sibley O'Brien ; illustrated by Susan Gal.","O'Brien, Anne Sibley","Toy and movable books Specimens, Stories in rhyme, Autumn Fiction, Toy and movable books","Abrams Appleseed,",2016.
Digital,OverDrive,AUDIOBOOK,2018,6,28,"The Year of Less: How I Stopped Shopping, Gave Away My Belongings, and Discovered Life Is Worth More Than Anything You Can Buy in a Store (unabridged) (Unabridged)",Cait Flanders,"Biography & Autobiography, Business, Finance, Nonfiction","Tantor Media, Inc",2018
Physical,Horizon,BOOK,2018,6,6,"First Earth encyclopedia / [original edition written and edited by Wendy Horobin and Caroline Stamps ; US editor, Margaret Parrish].","Horobin, Wendy","Earth sciences Encyclopedias Juvenile, Earth sciences Miscellanea, Encyclopedias","DK Publishing,",2018
Physical,Horizon,BOOK,2018,6,4,The historian : a novel / Elizabeth Kostova.,"Kostova, Elizabeth","Vampires Fiction, Occult fiction, Horror fiction","Back Bay Books,",2009.
Digital,OverDrive,EBOOK,2018,6,1,"The Art of Sinning: Sinful Suitors Series, Book 1",Sabrina Jeffries,"Fiction, Historical Fiction, Romance","Simon & Schuster, Inc.",2015
Physical,Horizon,BOOK,2018,6,1,The leader's guide to storytelling : mastering the art and discipline of business narrative / Stephen Denning.,"Denning, Stephen","Communication in management, Public speaking, Business communication, Communication in organizations","Jossey-Bass,",[2011]
Physical,Horizon,BOOK,2018,6,4,"Spider-women / Dennis Hopeless, Jason Latour & Robbie Thompson, story ; [art by] Vanesa del Rey, Bengal, Tana Ford, Joëlle Jones.","Hopeless, Dennis","Silk Fictitious character Comic books strips etc, Spider Woman Fictitious character Comic books strips etc, Women superheroes Comic books strips etc, Superhero comics, Comics Graphic works, Graphic novels","Marvel Worldwide, Inc.,",[2016]
Digital,OverDrive,EBOOK,2018,6,5,"Mercy: Buchanan-Renard Series, Book 2",Julie Garwood,"Fiction, Mystery, Romance, Thriller","Simon & Schuster, Inc.",2014
Digital,OverDrive,EBOOK,2018,6,3,Brightly Burning,Mercedes Lackey,"Fantasy, Fiction","Penguin Group (USA), Inc.",2009
Digital,OverDrive,EBOOK,2018,6,1,How Nancy Drew Saved My Life,Lauren Baratz-Logsted,"Chick Lit, Fiction, Romance","Harlequin Enterprises, Ltd.",2007
Physical,Horizon,BOOK,2018,6,5,"The Flash. Vol. 5, Negative / Joshua Williamson, writer ; Neil Googe, Christian Duce [and three others], artists ; Ivan Plascencia, Hi-Fi, colorists ; Steve Wands, Tom Napolitano, letterers.","Williamson, Joshua","Flash Fictitious character Comic books strips etc, Good and evil Comic books strips etc, Superheroes Comic books strips etc, Science fiction comic books strips etc, Superhero comics, Comics Graphic works, Graphic novels","DC Comics,",[2018]
Physical,Horizon,SOUNDDISC,2018,6,3,Barkskins : [a novel] / Annie Proulx.,"Proulx, Annie","Indentured servants 17th century Fiction, Canada History 17th century, Historical fiction, Historical fiction, Epic fiction, Audiobooks","Simon & Schuster Audio,",[2016]
Digital,OverDrive,EBOOK,2018,6,3,Pancakes in Paris: Living the American Dream in France,Craig Carlson,"Biography & Autobiography, Cooking & Food, Nonfiction, Travel",Sourcebooks,2016
Physical,Horizon,BOOK,2018,6,1,"The lonely mailman / Susanna Isern, Daniel Montero Galán ; [English translation by Jon Brokenbrow].","Isern, Susanna","Letter carriers Juvenile fiction, Letters Juvenile fiction, Forest animals Juvenile fiction, Friendship Juvenile fiction","Cuento de Luz SL,",[2016]
Physical,Horizon,BOOK,2018,6,3,Confessions of a sociopath : a life spent hiding in plain sight / M. E. Thomas.,"Thomas, M. E.","Antisocial personality disorders, Psychopaths","Crown Publishers,",[2013]
Physical,Horizon,SOUNDDISC,2018,6,8,Now that's what I call running 2014.,,"Rock music, Popular music, Exercise music","Sony Music/Universal,",[2014]
Digital,OverDrive,EBOOK,2018,6,4,Three Amazing Things About You,Jill Mansell,"Fiction, Humor (Fiction), Literature, Romance",Sourcebooks,2016
Physical,Horizon,BOOK,2018,6,1,The grammar of rock : art and artlessess in 20th century pop lyrics / by Alexander Theroux.,"Theroux, Alexander","Popular music History and criticism, Songs Texts History and criticism","Fantographics Books,",[2013]
Physical,Horizon,BOOK,2018,6,7,Happy! / Pharrell Williams ; [interior photography by Amanda Pratt].,"Williams, Pharrell","Happiness Pictorial works Juvenile literature, Conduct of life Pictorial works Juvenile literature, Childrens songs United States Texts, Songs United States Texts, Songs","G.P. Putnam's Sons, an imprint of Penguin Random House,",[2015]
Digital,OverDrive,EBOOK,2018,6,2,"Lonnie's Warrior Sword: Descendants: School of Secrets Series, Book 4",Jessica Brody,"Folklore, Juvenile Fiction, Juvenile Literature",Disney Digital Books,2017
Physical,Horizon,SOUNDDISC,2018,6,1,1.Outside / David Bowie.,"Bowie, David",Rock music 1991 2000,"Parlophone,",[2016]
Physical,Horizon,SOUNDDISC,2018,6,3,Antichrist superstar.,Marilyn Manson (Musical group),"Rock music 1991 2000, Heavy metal Music","Nothing/Interscope,",[1996]
Physical,Horizon,BOOK,2018,6,1,Lost in translation / Nicole Mones.,"Mones, Nicole","Fathers and daughters United States Fiction, Legislators United States Fiction, Americans Travel China Fiction, Archaeologists China Fiction, Young women China Fiction, Translators China Fiction, Peking man Fiction, China Social life and customs Fiction, China Antiquities Fiction","Delta Trade Paperbacks,",1999.
Physical,Horizon,BOOK,2018,6,2,Garfield sits around the house / by Jim Davis.,"Davis, Jim, 1945 July 28-","Garfield Fictitious character Comic books strips etc, Cats Comic books strips etc, American wit and humor Pictorial, Cartoons and comics, Comic books strips etc","Ballantine Books,",2004.
Physical,Horizon,BOOK,2018,6,1,Computers for seniors / by Nancy C. Muir.,"Muir, Nancy, 1954-","Microcomputers, Computers and older people","John Wiley & Sons, Inc.,",[2017]
Digital,OverDrive,EBOOK,2018,6,6,"The Other Wes Moore: One Name, Two Fates",Wes Moore,"African American Nonfiction, Biography & Autobiography, Nonfiction","Random House, Inc.",2010
Digital,OverDrive,EBOOK,2018,6,1,Choke,Stuart Woods,"Fiction, Thriller",HarperCollins Publishers Inc.,2012
Physical,Horizon,VIDEODISC,2018,6,2,Doozers. Meet the pod squad! / The Jim Henson Company.,,"Problem solving Juvenile drama, Building Juvenile drama, Inventions Juvenile drama, Childrens television programs, Animated television programs, Television series, Fiction television programs, Video recordings for the hearing impaired","NCircle Entertainment,",[2015]
Physical,Horizon,BOOK,2018,6,2,Would you rather ... shake like a dog or climb like a cat? / Camilla de la Bédoyère and Mel Howells.,"De la Bédoyère, Camilla","Pets Miscellanea Juvenile literature, Dogs Miscellanea Juvenile literature, Cats Miscellanea Juvenile literature, Childrens questions and answers","QEB Publishing, Inc.,",[2015]
Physical,Horizon,BOOK,2018,6,2,"Killing monsters : why children need fantasy, super heroes, and make-believe violence / Gerard Jones ; foreword by Lynn Ponton.","Jones, Gerard, 1957-","Mass media and children, Popular culture Psychological aspects, Fantasy in children, Imagination in children, Adjustment Psychology in children, Fantasy in mass media, Monsters in mass media, Heroes in mass media, Violence in mass media","Basic Books,",[2002]
Physical,Horizon,BOOK,2018,6,8,The Berenstain Bears and the mama's day surprise / Stan and Jan Berenstain.,"Berenstain, Stan, 1923-2005","Mothers Day Juvenile fiction, Surprise Juvenile fiction, Bears Juvenile fiction","Random House,",[2004]
Physical,Horizon,BOOK,2018,6,17,Your pal Archie. Volume one / story & inks by Ty Templeton ; art by Dan Parent ; lettering by Jack Morelli ; colors by Andre Szymanowicz.,"Templeton, Ty","Andrews Archie Fictitious character Comic books strips etc, Lodge Veronica Fictitious character Comic books strips etc, Cooper Betty Fictitious character Comic books strips etc, Teenagers Comic books strips etc, High school students Comic books strips etc, Humorous comics, Comics Graphic works, Graphic novels","Archie Comic Publications,",2018.
Physical,Horizon,BOOK,2018,6,3,Last rituals : a novel of suspense / Yrsa Sigurdardóttir ; translated from the Icelandic by Bernard Scudder.,Yrsa Sigurðardóttir,"Th¢ra Gudmundsd¢ttir Fictitious character Fiction, Blood accusation Iceland Fiction, Murder Iceland Fiction, Women lawyers Fiction, Reykjav¡k Iceland Fiction, Mystery fiction","Harper,",2009.
Physical,Horizon,SOUNDDISC,2018,6,1,Psych-out Christmas.,,"Christmas music, Rock music 2011 2020","Cleopatra Records,",[2013]
Physical,Horizon,BOOK,2018,6,1,The night before Christmas / written by Clement C. Moore ; retold and illustrated by Rachel Isadora.,"Moore, Clement Clarke, 1779-1863","Santa Claus Juvenile poetry, Christmas Poetry, American poetry Juvenile literature","G. P. Putnam's Sons,",[2009]
Physical,Horizon,BOOK,2018,6,2,Dolphins / Anna Claybourne.,"Claybourne, Anna",Dolphins Juvenile literature,"Capstone Heinemann Library,",[2013]
Digital,OverDrive,AUDIOBOOK,2018,6,1,No Matter What!: 9 Steps to Living the Life You Love (unabridged) (Unabridged),Lisa Nichols,"Nonfiction, Self-Improvement",Hachette Audio,2009
Physical,Horizon,BOOK,2018,6,1,A giraffe goes to Paris / by Mary Tavener Holmes and John Harris ; illustrated by Jon Cannell.,"Holmes, Mary Tavener","Giraffe Egypt Biography Juvenile literature, Giraffe France Paris Biography Juvenile literature, Zoo animals France Paris History 19th century Juvenile literature, Diplomatic gifts History 19th century Juvenile literature, Wild animals as pets History 19th century Juvenile literature, Exotic animals History 19th century Juvenile literature, Giraffe Juvenile fiction, Zoo animals Juvenile fiction, Kings queens rulers etc Fiction, Diplomatic gifts Juvenile fiction, Wild animals as pets Juvenile fiction, Exotic animals Juvenile fiction, Egypt Kings and rulers History 19th century Juvenile literature, France Kings and rulers History 19th century Juvenile literature","Marshall Cavendish Children,",2010.
Physical,Horizon,BOOK,2018,6,9,How to hygge : the Nordic secrets to a happy life / Signe Johansen.,"Johansen, Signe","Self actualization Psychology, Conduct of life, Happiness, Human comfort Denmark","St. Martin's Griffin,",2017.
Digital,OverDrive,EBOOK,2018,6,1,"Murder at the PTA: Beth Kennedy Series, Book 1",Laura Alden,"Fiction, Mystery","Penguin Group (USA), Inc.",2011
Digital,OverDrive,EBOOK,2018,6,1,"Miss Dimple Picks a Peck of Trouble: Miss Dimple Kilpatrick Series, Book 4",Mignon F. Ballard,"Fiction, Historical Fiction, Mystery",Macmillan Publishers,2014
Digital,OverDrive,EBOOK,2018,6,4,Make Me Love You,Johanna Lindsey,"Fiction, Historical Fiction, Romance","Simon & Schuster, Inc.",2016
Physical,Horizon,VIDEODISC,2018,6,5,"Empire of the sun / Warner Bros. Pictures ; a Robert Shapiro production ; produced by Steven Spielberg, Kathleen Kennedy, Frank Marshall ; screenplay by Tom Stoppard ; directed by Steven Spielberg.",,"World War 1939 1945 China Shanghai Drama, Boys China Shanghai Drama, World War 1939 1945 Prisoners and prisons Japanese Drama, World War 1939 1945 Children China Shanghai Drama, War films, Coming of age films, Feature films, Fiction films, Historical films, Video recordings for the hearing impaired","Warner Home Video : Warner Bros. Entertainment,",[2009]
Digital,OverDrive,EBOOK,2018,6,5,"The Explosive Child: A New Approach for Understanding and Parenting Easily Frustrated, Chronically Inflexible Children","Ross W. Greene, PhD","Family & Relationships, Nonfiction",HarperCollins Publishers Inc.,2014
Physical,Horizon,BOOK,2018,6,3,We are dancing for you : native feminisms and the revitalization of women's coming-of-age ceremonies / Cutcha Risling Baldy.,"Risling Baldy, Cutcha,","Hupa women Rites and ceremonies, Hupa Indians Rites and ceremonies, Puberty rites California, Menstruation Social aspects, Hupa dance","University of Washington Press,",2018.
Physical,Horizon,BOOK,2018,6,1,Rembrandt's eyes / Simon Schama.,"Schama, Simon","Rembrandt Harmenszoon van Rijn 1606 1669, Painters Netherlands Biography","Penguin Books,",2014.
Digital,OverDrive,EBOOK,2018,6,3,To Have and Have Not,Ernest Hemingway,"Classic Literature, Fiction, Literature","Simon & Schuster, Inc.",2014
Digital,OverDrive,EBOOK,2018,6,41,"Promise Not to Tell: Cutler, Sutter & Salinas Series, Book 2",Jayne Ann Krentz,"Fiction, Romance, Suspense, Thriller","Penguin Group (USA), Inc.",2018
Physical,Horizon,BOOK,2018,6,10,Benny and Penny in Lost and found / by Geoffrey Hayes.,"Hayes, Geoffrey","Mood Psychology Comic books strips etc, Lost articles Comic books strips etc, Brothers and sisters Comic books strips etc, Mice Comic books strips etc, Cartoons and comics, Graphic novels","Toon Books, is an imprint of Candlewick Press,",[2014]
Physical,Horizon,BOOK,2018,6,1,The complete idiot's guide to Pinterest marketing / by Christine Martinez and Barbara Boyd.,"Martinez, Christine","Pinterest, Internet marketing","Alpha Books,",[2012]
Physical,Horizon,BOOK,2018,6,1,Dolls of hope / Shirley Parenteau.,"Parenteau, Shirley","Dolls Juvenile fiction, Schoolgirls Japan Juvenile fiction, Japan Juvenile fiction","Candlewick Press,",2015.
Digital,OverDrive,AUDIOBOOK,2018,6,6,VocabuLearn® Spanish Word Booster: Bilingual Format (unabridged) (Unabridged),"Penton Overseas, Inc.","Foreign Language Study, Young Adult Nonfiction","Penton Overseas, Inc.",2005
Physical,Horizon,BOOK,2018,6,1,Robert Ludlum's The Bourne initiative / by Eric Van Lustbader.,"Lustbader, Eric","Bourne Jason Fictitious character Fiction, Traitors Fiction, Intelligence officers Fiction, Terrorists Somalia Fiction, Russians Fiction, Large type books, Thrillers Fiction, Spy fiction","Grand Central Publishing Large Print,",2017.
Physical,Horizon,BOOK,2018,6,2,Ostrich and lark / Marilyn Nelson ; illustrated by San artists of the Kuru Art Project of Botswana.,"Nelson, Marilyn, 1946-","Ostriches Juvenile fiction, Larks Juvenile fiction","Boyds Mills Press,",[2012]
Physical,Horizon,BOOK,2018,6,3,Peru / by Michael Burgan.,"Burgan, Michael","Peru Juvenile literature, Instructional and educational works","Children's Press, an Imprint of Scholastic,",2018.
Physical,Horizon,BOOK,2018,6,1,Treasured by Thursday / Catherine Bybee.,"Bybee, Catherine","Billionaires Fiction, Businesswomen Fiction, Man woman relationships Fiction, Love stories, Erotic fiction, Romantic suspense fiction","Montlake Romance,",[2015]
Digital,OverDrive,AUDIOBOOK,2018,6,31,"Barracoon: The Story of the Last ""Black Cargo"" (unabridged) (Unabridged)",Zora Neale Hurston,"History, Nonfiction, Sociology",HarperCollins Publishers Inc.,2018
Physical,Horizon,BOOK,2018,6,2,"Obsessive-compulsive disorders : a complete guide to getting well and staying well / by Fred Penzel, Ph.D.","Penzel, Fred",Obsessive compulsive disorder Popular works,"Oxford University Press,",[2017]
Physical,Horizon,BOOK,2018,6,2,Goatilocks and the three bears / Erica S. Perl ; illustrated by Arthur Howard.,"Perl, Erica S.","Goats Fiction, Bears Fiction","Beach Lane Books,",[2014]
Digital,OverDrive,EBOOK,2018,6,2,"Baby Monkey, Private Eye",Brian Selznick,"Beginning Reader, Humor (Fiction), Juvenile Fiction, Mystery","Scholastic, Inc. (US)",2018
Digital,OverDrive,EBOOK,2018,6,2,"Rising Darkness: Finding Sanctuary Series, Book 3",Nancy Mehl,"Fiction, Literature, Romance, Suspense",Baker Publishing Group,2016
Digital,OverDrive,EBOOK,2018,6,1,"The Money Workbook: A 30-day Program to Greater Abundance, Prosperity, and Self-Worth",Roger Bruce Lane,"Business, Finance, Nonfiction, Self-Improvement","Penguin Group (USA), Inc.",2009
Digital,OverDrive,AUDIOBOOK,2018,6,1,"I Am Number 8: Overlooked and Undervalued, but Not Forgotten by God (unabridged) (Unabridged)",John W. Gray III,"Nonfiction, Religion & Spirituality","Blackstone Audio, Inc.",2017
Digital,OverDrive,AUDIOBOOK,2018,6,8,A People's History of the United States: Highlights from the 20th Century (abridged) (Abridged),Howard Zinn,"History, Nonfiction",HarperCollins Publishers Inc.,2005
Digital,OverDrive,AUDIOBOOK,2018,6,1,"Rise of the Huntress: Last Apprentice Series, Book 7 (unabridged) (Unabridged)",Joseph Delaney,"Fantasy, Young Adult Fiction, Young Adult Literature","Recorded Books, LLC",2015
Physical,Horizon,BOOK,2018,6,2,2Fish : (a poetry book) / Jhené Aiko Efuru Chilombo.,"Jhené Aiko, 1988-","American poetry, Short stories American, Poetry, Short stories","Ulysses Press,",[2018]
Physical,Horizon,BOOK,2018,6,1,Star time / Patricia Reilly Giff ; illustrated by Alasdair Bright.,"Giff, Patricia Reilly","Schools Fiction, Theater Fiction, Generosity Juvenile fiction","Wendy Lamb Books,",2011.
Digital,OverDrive,EBOOK,2018,6,4,"Girl Code: Unlocking the Secrets to Success, Sanity, and Happiness for the Female Entrepreneur",Cara Alwill Leyba,"Business, Economics, Nonfiction, Women's Studies","Penguin Group (USA), Inc.",2017
Digital,OverDrive,AUDIOBOOK,2018,6,4,The House of Mirth (Unabridged),Edith Wharton,"Classic Literature, Fiction","Blackstone Audio, Inc.",2005
Physical,Horizon,VIDEODISC,2018,6,2,"The battle of Chosin / a Film Posse, Inc. production for American Experience ; written by Mark Zwonitzer ; produced and directed by Randall MacLowry ; executive producer, Mark Samels.",,"Korean War 1950 1953 Campaigns Korea North Changjin Reservoir, Documentary films, War films, Nonfiction films, Video recordings for the hearing impaired","Distributed by PBS Distribution,",c2017.
Physical,Horizon,BOOK,2018,6,4,Could be worse! / James Stevenson.,"Stevenson, James, 1929-2017",Dreams Juvenile fiction,"Mulberry Books,",1987.
Physical,Horizon,SOUNDDISC,2018,6,3,Angel in disguise / Leon Russell.,"Russell, Leon","Rock music 2001 2010, Popular music 2001 2010","Leon Russell Records,",[2006]
Digital,OverDrive,AUDIOBOOK,2018,6,2,The Unthinkable: Who Survives When Disaster Strikes--and Why (unabridged) (Unabridged),Amanda Ripley,"Nonfiction, Psychology",Books on Tape,2008
Digital,OverDrive,AUDIOBOOK,2018,6,4,Happiness for Beginners (Unabridged),Katherine Center,"Fiction, Literature","Blackstone Audio, Inc.",2015
Physical,Horizon,BOOK,2018,6,2,Record breakers. The biggest / Claire Llewellyn and Thea Feldman.,"Llewellyn, Claire",Curiosities and wonders Juvenile literature,"Kingfisher,",[2012]
Physical,Horizon,VIDEODISC,2018,6,6,"Air bound / Grindstone Entertainment Group ; SC Films International ; Shirogumi Inc. ; English version created by Bang Zoom Entertainment ; producer, Tetsu Fujimara, Kenichiro Hayahune, Tsutomo Kuno ; script, Ryota Kosawa ; directors, Tomohiro Kawamura, Yoshihiro Komori.",,"Mice Juvenile drama, Weasels Juvenile drama, Sailing Juvenile drama, Feature films, Animated films, Childrens films, Fiction films, Video recordings for the hearing impaired","Grindstone,",[2017]
Digital,OverDrive,EBOOK,2018,6,1,The Last Original Wife: A Novel,Dorothea Benton Frank,"Fiction, Humor (Fiction), Literature",HarperCollins Publishers Inc.,2013
Physical,Horizon,SOUNDDISC,2018,6,1,Catching a tiger / Lissie.,"Lissie, 1982-","Popular music 2001 2010, Rock music 2001 2010","Fat Possum Records,",[2010]
Physical,Horizon,SOUNDDISC,2018,6,3,Kidz bop 27.,,"Childrens songs Juvenile sound recordings, Popular music 2011 2020 Juvenile sound recordings, Songs","Kidz Bop,",[2015]
Digital,OverDrive,AUDIOBOOK,2018,6,1,"The Seduction of Miss Amelia Bell: The MacGregors: Highland Heirs Series, Book 1 (unabridged) (Unabridged)",Paula Quinn,"Fiction, Historical Fiction, Romance","Blackstone Audio, Inc.",2014
Physical,Horizon,SOUNDDISC,2018,6,2,Six Brandenburg concertos / Johann Sebastian Bach.,"Bach, Johann Sebastian, 1685-1750",Concerti grossi,"Linn Records,",[2013]
Physical,Horizon,BOOK,2018,6,2,Brother's ruin / Emma Newman.,"Newman, Emma, 1976-","Magic Fiction, Wizards Fiction, Brothers and sisters Fiction, Great Britain History Victoria 1837 1901 Fiction, Fantasy fiction, Historical fiction","Tor.com,",2017.
Physical,Horizon,VIDEODISC,2018,6,5,"Seeds of yesterday / Lifetime Pictures ; teleplay by Darren Stein ; producers, Richard D. Arredondo, Harvey Kahn ; directed by Shawn Ku.",,"Incest Drama, Teenagers Drama, Child abuse Drama, Brothers and sisters Drama, Revenge Drama, Made for TV movies, Fiction television programs, Television melodramas, Video recordings for the hearing impaired","Lionsgate,",[2015]
Digital,OverDrive,AUDIOBOOK,2018,6,1,"The Case of the Missing Servant: Vish Puri, Most Private Investigator Series, Book 1 (unabridged) (Unabridged)",Tarquin Hall,"Fiction, Mystery","Blackstone Audio, Inc.",2009
Digital,OverDrive,EBOOK,2018,6,1,"The Sword-Edged Blonde: Eddie LaCrosse Series, Book 1",Alex Bledsoe,"Fantasy, Fiction, Mystery",Macmillan Publishers,2013
Physical,Horizon,BOOK,2018,6,2,The beachcomber's guide to seashore life in the Pacific Northwest / J. Duane Sept.,"Sept, J. Duane, 1950-","Seashore biology Northwest Pacific Identification, Seashore biology Northwest Pacific","Harbour Pub.,",2009.
Physical,Horizon,BOOK,2018,6,2,We rise : [the earth guardians guide to building a movement that restores the planet] / Xiuhtezcatl Martinez with Justin Spizman.,"Martinez, Xiuhtezcatl","Environmental protection Citizen participation, Green movement, Climatic changes, Environmentalism, Sustainable living, Youth Conduct of life","Rodale,",[2017]
Physical,Horizon,CR,2018,6,6,The car book / by Jack Gillis.,,"Automobiles Purchasing Periodicals, Automobiles Periodicals, Consumer education Periodicals","Center for Auto Safety,",c2002-
Physical,Horizon,VIDEODISC,2018,6,1,"Lamerica / Cecchi Gori Group ; una coproduzione italo-francese C.G.G. Tiger Cinematográfica, Arena Films ; con la collaborazione delia RAI Radiotelevisione Italiana, delia Vega Film di Canal+, e del Centre National de la Cineḿatographie, con il sostegno del Fondo Eurimages del Consiglio d'Europa ; prodotta da Mario e Vittorio Cecchi Gori ; soggetto e sceneggiartura Gianni Amelio, Andrea Porporati, Alessandro Sermoneta ; regia di Gianni Amelio.",,"Capitalists and financiers Drama, Albania Politics and government Drama, Feature films, Fiction films, Motion pictures Italian, Video recordings for the hearing impaired","New Yorker Video,",[2004]
Physical,Horizon,VIDEODISC,2018,6,1,"Love begins / RHI Entertainment ; a Faith & Family Entertainment production ; in association with MNG Films Ireland and Larry Levinson Productions ; produced by Lincoln Lageson, Erik Heiberg ; written by Michael Moran ; directed by David S. Cass, Sr.",,"Frontier and pioneer life West U S Drama, Man woman relationships Drama, Farm life Drama, Made for TV movies, Western television programs, Fiction television programs, Video recordings for the hearing impaired","20th Century Fox Home Entertainment,",[2011]
Physical,Horizon,SOUNDDISC,2018,6,3,Live at Shea Stadium / the Clash.,Clash (Musical group),"Rock music 1981 1990, Punk rock music","Epic/Legacy,",[2008]
Physical,Horizon,BOOK,2018,6,1,Profitable fruit-growing for cottagers and small holders of land.,"Wright, John, 1836-1919",Fruit culture,"Collingridge,",1910.
Digital,OverDrive,EBOOK,2018,6,23,The Wangs vs. the World,Jade Chang,"Fiction, Literature",Houghton Mifflin Harcourt Trade and Reference,2016
