Digital,OverDrive,EBOOK,2018,6,2,In Search of Us,Ava Dellaira,"Romance, Young Adult Fiction, Young Adult Literature",Macmillan Publishers,2018
Physical,Horizon,BOOK,2018,6,2,Collected poems 1956-1987 / John Ashbery ; [Mark Ford is the editor of this volume].,"Ashbery, John, 1927-2017",,"Library of America : Distributed to the trade in the United States by Penguin Putnam,",[2008]
Digital,OverDrive,VIDEO,2018,6,1,Franklin's Rival,Nelvana,Children's Video,Visual Education Centre,2009
Physical,Horizon,BOOK,2018,6,1,All new letters from a nut / Ted L. Nancy ; [illustrated by Alan Marder ; foreword by Jerry Seinfeld].,"Nancy, Ted L.","Letters Humor, American wit and humor","Broadway Books,",[2010]
Digital,OverDrive,EBOOK,2018,6,2,"The Vegan Slow Cooker: Simply Set It and Go with 150 Recipes for Intensely Flavorful, Fuss-Free Fare Everyone (Vegan or Not!) Will Devour",Kathy Hester,"Cooking & Food, Nonfiction",Quarto Publishing Group USA,2011
Physical,Horizon,BOOK,2018,6,2,"A journey through the digestive system with Max Axiom, super scientist / by Emily Sohn ; illustrated by Cynthia Martin and Barbara Schulz.","Sohn, Emily","Digestive organs Juvenile literature, Digestive organs Comic books strips etc, Digestion Juvenile literature, Digestion Comic books strips etc, Digestive system, Cartoons and comics, Graphic novels, Nonfiction comics","Capstone Press,",[2009]
Physical,Horizon,CR,2018,6,1,The year's best science fiction.,,"Science fiction American Periodicals, Science fiction Periodicals","Bluejay Books,",1984-
Physical,Horizon,BOOK,2018,6,1,How dogs love us : a neuroscientist and his adopted dog decode the canine brain / Gregory Berns.,"Berns, Gregory","Dogs Psychology Research, Dogs Nervous system Research, Brain Magnetic resonance imaging","Houghton Mifflin Harcourt,",2013.
Physical,Horizon,BOOK,2018,6,5,Mr. Macky is wacky! / Dan Gutman ; pictures by Jim Paillot.,"Gutman, Dan","Teachers Juvenile fiction, Schools Fiction, Presidents Juvenile fiction, Humorous stories","HarperCollinsPublishers,",2007.
Physical,Horizon,BOOK,2018,6,2,A short history of women : a novel / Kate Walbert.,"Walbert, Kate, 1961-","Women Fiction, Generations Fiction","Scribner,",2009.
Physical,Horizon,BOOK,2018,6,1,Primary grade challenge math / Edward Zaccaro.,"Zaccaro, Edward","Mathematics Problems exercises etc, Mathematics Study and teaching Primary","Hickory Grove Press,",[2003]
Physical,Horizon,SOUNDDISC,2018,6,1,Controversial Negro / the Jon Spencer Blues Explosion.,Jon Spencer Blues Explosion (Musical group),Rock music 1991 2000,"Major Domo,",[2010]
Physical,Horizon,BOOK,2018,6,2,Our unmet needs / Charles Stanley.,"Stanley, Charles F.",Christian life Baptist authors,"T. Nelson,",[1999]
Physical,Horizon,BOOK,2018,6,1,DIY solar projects : small projects to whole-home systems : tap into the sun / Eric Smith and Philip Schmidt with Troy Wanek.,"Smith, Eric W. (Eric William), 1951-","Solar houses Amateurs manuals, Dwellings Energy conservation Amateurs manuals, Photovoltaic power generation Amateurs manuals, Solar heating Amateurs manuals","Cool Springs Press,",c2017.
Digital,OverDrive,EBOOK,2018,6,3,Hard As You Can: A Hard Ink Novel,Laura Kaye,"Fiction, Romance, Suspense",HarperCollins Publishers Inc.,2014
Physical,Horizon,BOOK,2018,6,1,The bearded gentleman : the style guide to shaving face / Allan Peterkin & Nick Burns.,"Peterkin, Allan D.","Beards, Shaving, Grooming for men","Arsenal Pulp Press,",[2010]
Physical,Horizon,SOUNDDISC,2018,6,2,"Concerti per violino. III : ""Il ballo"" / Vivaldi.","Vivaldi, Antonio, 1678-1741",Concertos Violin with string orchestra,"Naïve,",[2008]
Physical,Horizon,BOOK,2018,6,4,"Retire inspired : it's not an age, it's a financial number / Chris Hogan ; foreword by Dave Ramsey.","Hogan, Chris E. (Chris Elizabeth), 1964-","Retirement income Planning, Retirement Planning, Finance Personal, Investments, Saving and investment","Ramsey Press,",[2016]
Physical,Horizon,SOUNDDISC,2018,6,2,Carney / Leon Russell.,"Russell, Leon","Popular music 1971 1980, Rock music 1971 1980","Right Stuff,",[1995]
Digital,OverDrive,EBOOK,2018,6,3,The Best American Mystery Stories 2013,Otto Penzler,"Fiction, Mystery, Short Stories",Houghton Mifflin Harcourt Trade and Reference,2015
Physical,Horizon,VIDEODISC,2018,6,8,"The artist / the Weinstein Company ; a coproduction La Petite Reine, Studio 37, Classe Américaine, JD Prod, France 3 Cinéma, Jouror Productions, uFilm ; with the participation of Canal+ and CinéCinéma, France Télévisions ; produced by Thomas Langmann ; written & directed by Michel Hazanavicius.",,"Silent films Drama, Actors Drama, Motion picture industry Drama, Hollywood Los Angeles Calif Drama, Feature films, Fiction films, Silent films, Comedy films, Video recordings for the hearing impaired","Sony Pictures Home Entertainment,",[2012]
Digital,OverDrive,EBOOK,2018,6,1,Camo Girl,Kekla Magoon,"Juvenile Fiction, Juvenile Literature","Simon & Schuster, Inc.",2016
Physical,Horizon,BOOK,2018,6,1,The digital photography book. Part 4 : the step-by-step secrets for how to make your photos look like the pros'! / Scott Kelby.,"Kelby, Scott",Photography Digital techniques,"Peachpit Press,",[2012]
Physical,Horizon,BOOK,2018,6,1,"Gantz. 34 / story and art by Hiroya Oku ; [translation, Matthew Johnson ; lettering and retouch, Studio Cutie].","Oku, Hiroya","Human alien encounters Comic books strips etc, Extraterrestrial beings Comic books strips etc, Battles Comic books strips etc, Future life Comic books strips etc, Graphic novels Japan Translations into English, Death Comic books strips etc, Horror comics, Graphic novels, Comic books strips etc","Dark Horse Manga,",2015.
Digital,OverDrive,EBOOK,2018,6,11,Undead Girl Gang,Lily Anderson,"Humor (Fiction), Young Adult Fiction","Penguin Group (USA), Inc.",2018
Physical,Horizon,VIDEODISC,2018,6,3,"Cheers. The first season / Charles/Burrows/Charles Productions ; Paramount Television ; producers, David Angell, Peter Casey, Glen Charles, Les Charles ... [and others] ; writers, David Angell, Rod Burton, Peter Casey ; directors, Tim Berry, James Burrows.",,"Bars Drinking establishments Drama, Waitresses Drama, Man woman relationships Drama, Television series, Television comedies, Fiction television programs, Video recordings for the hearing impaired","Paramount,",[2003]
Physical,Horizon,BOOK,2018,6,7,Endangered / C.J. Box.,"Box, C. J.","Pickett Joe Fictitious character Fiction, Game wardens Fiction, Murder Investigation Fiction, Wyoming Fiction, Suspense fiction, Mystery fiction","G.P. Putnam's Sons,",[2015]
Physical,Horizon,SOUNDDISC,2018,6,1,See you in the cosmos / Jack Cheng.,"Cheng, Jack, 1983-","Children of single parents Juvenile fiction, Dysfunctional families Juvenile fiction, Life on other planets Juvenile fiction, Family problems Fiction, Childrens audiobooks","Random House/Listening Library,",[2017]
Digital,OverDrive,AUDIOBOOK,2018,6,11,"Worth It: Your Life, Your Money, Your Terms (unabridged) (Unabridged)",Amanda Steinberg,"Business, Economics, Finance, Nonfiction",Simon & Schuster - All Library,2017
Physical,Horizon,BOOK,2018,6,2,Captain America : the first Avenger / adapted by Alex Irvine.,"Irvine, Alexander (Alexander C.)","Captain America the first avenger Motion picture Adaptations Juvenile fiction, Captain America Fictitious character Juvenile fiction, Heroes Juvenile fiction, Good and evil Juvenile fiction, Science fiction","Little, Brown and Company,",2014.
Physical,Horizon,SOUNDDISC,2018,6,3,S.O.U.L. / the O'Jays.,O'Jays (Musical group),"Soul music, Popular music 1971 1980","Sony Music,",[2015]
Physical,Horizon,BOOK,2018,6,14,"SpongeBob comics. #1, Silly sea stories / Stephen Hillenburg ; edited by Chris Duffy.","Hillenburg, Stephen","SpongeBob SquarePants Fictitious character Comic books strips etc, Marine animals Comic books strips etc, Cartoons and comics, Graphic novels, Humorous comics","Amulet Books,",2017.
Physical,Horizon,BOOK,2018,6,1,The good good pig : the extraordinary life of Christopher Hogwood / Sy Montgomery.,"Montgomery, Sy","Montgomery Sy, Swine as pets New Hampshire Anecdotes, Pet owners New Hampshire Biography, Human animal relationships New Hampshire Anecdotes","Ballantine Books,",2007.
Digital,OverDrive,EBOOK,2018,6,1,10 Things to Do Before I Die,Daniel Ehrenhaft,"Romance, Young Adult Fiction, Young Adult Literature","Random House, Inc.",2011
Digital,OverDrive,AUDIOBOOK,2018,6,2,The Foundling: And Other Tales of Prydain (unabridged) (Unabridged),Lloyd Alexander,"Juvenile Fiction, Juvenile Literature, Short Stories",Books on Tape,2017
Physical,Horizon,BOOK,2018,6,1,"Kingdom Hearts II. 1 / Shiro Amano ; original concept Tetsuya Nomura ; [translation, Alethea and Athena Nibley; lettering, Lys Blakeslee, Terri Delgado].","Amano, Shiro","Magic Comic books strips etc, Friendship Comic books strips etc, Good and evil Comic books strips etc, Role playing Comic books strips etc, Disney characters Comic books strips etc, Cartoons and comics Fiction, Fantasy comics, Graphic novels","Yen Press,",[2013]
Physical,Horizon,BOOK,2018,6,4,Sunset express / Robert Crais.,"Crais, Robert","Cole Elvis Fictitious character Fiction, Pike Joe Fictitious character Fiction, Women detectives California Los Angeles Fiction, Private investigators California Los Angeles Fiction, Los Angeles Calif Fiction, Detective and mystery fiction","Ballantine Books,",2005.
Physical,Horizon,SOUNDDISC,2018,6,2,When the pawn / Fiona Apple.,"Apple, Fiona",Popular music 1991 2000,"Clean Slate/Epic,",[1999]
Digital,OverDrive,EBOOK,2018,6,1,"Expecting to Die: To Die Series, Book 7",Lisa Jackson,"Fiction, Mystery, Suspense, Thriller","Random House, Inc.",2017
Physical,Horizon,BOOK,2018,6,6,Prussian blue / Philip Kerr.,"Kerr, Philip","Gunther Bernhard Fictitious character Fiction, Private investigators Fiction, Detective and mystery fiction","Published by G.P. Putnam's Sons,",2017.
Physical,Horizon,SOUNDDISC,2018,6,1,The garden / Kari Jobe.,"Jobe, Kari","Contemporary Christian music, Contemporary Christian music","Sparrow,",[2017]
Digital,OverDrive,AUDIOBOOK,2018,6,2,The Secret Agent (Unabridged),Joseph Conrad,"Classic Literature, Fiction","Blackstone Audio, Inc.",2010
Digital,OverDrive,EBOOK,2018,6,2,How to Make Your Money Last: The Indispensable Retirement Guide,Jane Bryant Quinn,"Business, Finance, Nonfiction","Simon & Schuster, Inc.",2016
Physical,Horizon,BOOK,2018,6,2,Mean moms rule : why doing the hard stuff now creates good kids later / Denise Schipani.,"Schipani, Denise","Parenting, Mother and child, Motherhood","Sourcebooks,",[2012]
Physical,Horizon,BOOK,2018,6,1,Marc Chagall. / [Translated from the German by Robert Allen],"Meyer, Franz, 1919-2007",Chagall Marc 1887 1985,"H. N. Abrams,",[19
Digital,OverDrive,AUDIOBOOK,2018,6,3,438 Days: An Extraordinary True Story of Survival at Sea (unabridged) (Unabridged),Jonathan Franklin,"Biography & Autobiography, Nature, Nonfiction, Sports & Recreations",Simon & Schuster - All Library,2015
Physical,Horizon,BOOK,2018,6,2,The complete Midshipman Bolitho / Alexander Kent.,"Kent, Alexander","Bolitho Richard Fictitious character Fiction, Midshipmen Fiction, Great Britain History Naval 18th century Fiction, Historical fiction, Sea stories","McBooks Press,",2006.
Physical,Horizon,BOOK,2018,6,1,The latter days : a memoir / Judith Freeman.,"Freeman, Judith, 1946-","Freeman Judith 1946, Women authors American 20th century Biography, Ex church members Mormon Church Biography","Pantheon,",[2016]
Digital,OverDrive,AUDIOBOOK,2018,6,21,Never Let Me Go (Unabridged),Kazuo Ishiguro,"Fiction, Science Fiction",Books on Tape,2006
Digital,OverDrive,EBOOK,2018,6,34,The High Tide Club: A Novel,Mary Kay Andrews,"Fiction, Literature, Romance",Macmillan Publishers,2018
Physical,Horizon,BOOK,2018,6,5,Ask me / by Bernard Waber ; illustrated by Suzy Lee.,"Waber, Bernard","Childrens questions and answers Juvenile fiction, Fathers and daughters Juvenile fiction, Parent and child Juvenile fiction, Neighborhoods Juvenile fiction, Questions and answers Fiction","Houghton Mifflin Harcourt,",[2015]
Physical,Horizon,"SOUNDDISC, VIDEODISC",2018,6,1,Imidiwan = Companions / Tinariwen.,Tinariwen (Musical group),"Tuaregs Mali Music, Songs Tamashek Mali, Popular music Mali 2001 2010","World Village,",[2009]
Physical,Horizon,BOOK,2018,6,1,Everyman / Philip Roth.,"Roth, Philip","Jewish men Fiction, Aging Fiction, Large type books, Domestic fiction, Psychological fiction","Random House Large Print,",[2006]
Digital,OverDrive,EBOOK,2018,6,3,The Rough Guide to Rome,Martin Dunford,"Nonfiction, Travel",DK Publishing & Rough Guides,2011
Digital,OverDrive,EBOOK,2018,6,3,"Drop Shot: Myron Bolitar Series, Book 2",Harlan Coben,"Fiction, Mystery, Suspense, Thriller","Random House, Inc.",2010
Physical,Horizon,BOOK,2018,6,4,Nomadland : surviving America in the twenty-first century / Jessica Bruder.,"Bruder, Jessica","Older people Employment United States, Retirees Employment United States, Retirement Economic aspects United States, Casual labor United States, Working poor United States, Migrant labor United States, Recreational vehicle living United States, Van life United States, Large type books","Thorndike Press, A part of Gale, a Cengage Company,",2018.
Physical,Horizon,BOOK,2018,6,5,Samson in the snow / Philip C. Stead.,"Stead, Philip Christian","Mammoths Juvenile fiction, Friendship Juvenile fiction, Snow Juvenile fiction, Animals Juvenile fiction","Roaring Brook Press,",2016.
Digital,OverDrive,EBOOK,2018,6,3,The One Hundred Nights of Hero: A Graphic Novel,Isabel Greenberg,"Comic and Graphic Books, Fantasy, Fiction, Literature","Hachette Digital, Inc.",2016
Physical,Horizon,BOOK,2018,6,3,I was here / by Gayle Forman.,"Forman, Gayle","Suicide Juvenile fiction, Grief Juvenile fiction, Best friends Juvenile fiction, Friendship Juvenile fiction, Mystery and detective stories, Washington State Juvenile fiction, Young adult fiction","Viking, an imprint of Penguin Group (USA),",2015.
Digital,OverDrive,EBOOK,2018,6,1,"The Best Punctuation Book, Period: A Comprehensive Guide for Every Writer, Editor, Student, and Businessperson",June Casagrande,"Language Arts, Nonfiction, Reference","Random House, Inc.",2014
Physical,Horizon,SOUNDDISC,2018,6,1,Afro-Caribbean party.,,"Popular music Caribbean Area 2011 2020, World music","Putumayo World Music,",[2015]
Digital,OverDrive,EBOOK,2018,6,40,Priestdaddy: A Memoir,Patricia Lockwood,"Biography & Autobiography, Humor (Nonfiction), Nonfiction, Religion & Spirituality","Penguin Group (USA), Inc.",2017
Physical,Horizon,BOOK,2018,6,1,Birthday letters / Ted Hughes.,"Hughes, Ted, 1930-1998",Plath Sylvia Poetry,"Farrar, Straus, Giroux,",1998.
Physical,Horizon,BOOK,2018,6,7,Cowboy car / by Jeanie Franz Ransom ; illustrated by Ovi Nedelcu.,"Ransom, Jeanie Franz, 1957-","Automobiles Juvenile fiction, Vocational interests Juvenile fiction, Cowboys Juvenile fiction, Ranch life Juvenile fiction, Rodeos Juvenile fiction","Two Lions,",[2017]
Physical,Horizon,BOOK,2018,6,1,Summer secrets : a novel / Jane Green.,"Green, Jane, 1968-","Self actualization Psychology in women Fiction, Self realization in women Fiction, Family secrets Fiction","St. Martin's Press,",2015.
Physical,Horizon,BOOK,2018,6,1,Mr. Pye / a novel by Mervyn Peake ; with drawings by the author.,"Peake, Mervyn, 1911-1968",,"Overlook Press,",1984.
Physical,Horizon,BOOK,2018,6,2,The odyssey of Homer / [Homer] ; translated and with an introduction by Richmond Lattimore.,Homer,"Odysseus King of Ithaca Mythological character Poetry, Epic poetry Greek","Harper Perennial Modern Classics,",2007.
Physical,Horizon,BOOK,2018,6,3,"The wellness project : how I learned to do right by my body, without giving up my life / Phoebe Lapine.","Lapine, Phoebe","Autoimmune diseases Diet therapy, Autoimmune diseases Diet therapy Recipes, Health Popular works","Pam Krauss Books/Avery,",[2017]
Physical,Horizon,BOOK,2018,6,8,Weird but true! 8 : 300 outrageous facts.,,Curiosities and wonders Juvenile literature,"National Geographic,",[2016]
Physical,Horizon,BOOK,2018,6,1,The family tree German genealogy guide : how to trace your germanic ancestry in Europe / James M. Beidler.,"Beidler, James M. (James Michael), 1960-","Germans Genealogy, German Americans Genealogy Handbooks manuals etc, Germany Genealogy, Germany Genealogy Handbooks manuals etc, Europe Genealogy Handbooks manuals etc","Family Tree Books,",[2014]
Physical,Horizon,VIDEODISC,2018,6,1,"Henry IV, part 2 / Shakespeare's Globe ; [written] by William Shakespeare ; stage director, Dominic Dromgoole ; screen director, Ross MacGibbon ; producers, Conrad Lynch, Lotte Buchan.",,"Henry IV King of England 1367 1413 Drama, Falstaff John Sir Fictitious character Drama, Great Britain Kings and rulers Drama, Filmed plays, Filmed performances, Feature films, Historical films, Fiction films","Kultur,",[2010]
Physical,Horizon,VIDEODISC,2018,6,5,"Le capital = Capital / une coproduction KG Productions, France 2 Cinema ; en association avec Cofinova 8 ; avec la participation de France Televisions, Canal+, Cine+ et du Centre National du Cinema et de l'Image Animee ; produit par Michele Ray-Gavras ; scénario, Costa-Gavras, Jean-Claude Grumberg, Karim Boukercha ; un film de Costa-Gavras.",,"Bankers Drama, Capitalists and financiers Drama, Investment banking Corrupt practices Drama, Banks and banking Corrupt practices Drama, Banks and banking International Drama, Hedge funds Drama, Motion pictures French, Feature films, Fiction films, Thrillers Motion pictures","Cohen Media Group,",[2014]
Physical,Horizon,BOOK,2018,6,1,Peace on Earth : a Christmas collection / Mary Engelbreit.,"Engelbreit, Mary","Christmas Literary collections Juvenile literature, Christmas Quotations maxims etc Juvenile literature, Carols English Juvenile literature, Christmas Literary collections, Christmas Quotations maxims etc","Zonderkidz,",[2013]
Physical,Horizon,BOOK,2018,6,2,Don't squish the sasquatch! / by Kent Redeker ; illustrated by Bob Staake.,"Redeker, Kent","Imaginary creatures Fiction, Buses Juvenile fiction, Toy and movable books Juvenile fiction, Humorous stories","Disney/Hyperion Books,",[2012]
Digital,OverDrive,EBOOK,2018,6,13,"There's No Such Thing as Bad Weather: A Scandinavian Mom's Secrets for Raising Healthy, Resilient, and Confident Kids (from Friluftsliv to Hygge)",Linda Åkeson McGurk,"Education, Family & Relationships, Nature, Nonfiction","Simon & Schuster, Inc.",2017
Digital,OverDrive,EBOOK,2018,6,6,"Motive: Alex Delaware Series, Book 30",Jonathan Kellerman,"Fiction, Mystery, Suspense, Thriller","Random House, Inc.",2015
Digital,OverDrive,EBOOK,2018,6,1,Soccer 'Cats 4: Hat Trick,Matt Christopher,Juvenile Fiction,childrensElibrary,2005
Physical,Horizon,SOUNDDISC,2018,6,1,The Weber sisters / Mozart.,"Mozart, Wolfgang Amadeus, 1756-1791","Operas Excerpts, Overtures, Orchestral music, Variations Orchestra Arranged, Songs High voice with orchestra, Woodwind trios Basset horns 2 bassoon, Songs Unaccompanied, Masses Excerpts, Operas, Overtures, Variations Music, Songs, Masses, Excerpts","Erato/Warner Classics,",[2015]
Physical,Horizon,VIDEODISC,2018,6,7,"Finding Vivian Maier / Sundance Selects and Ravine Pictures present ; produced by John Maloof & Charlie Siskel ; executive producer, Jeff Garlin ; written & directed by John Maloof & Charlie Siskel.",,"Maier Vivian 1926 2009, Photographers Biography, Street photography, Feature films, Biographical films, Documentary films, Nonfiction films, Video recordings for the hearing impaired","Distributed by MPI Media Group,",c2014.
Digital,OverDrive,EBOOK,2018,6,1,Heir Chronicles: Books1-3,Cinda Williams Chima,"Mythology, Young Adult Fiction, Young Adult Literature",Disney Digital Books,2015
Digital,OverDrive,AUDIOBOOK,2018,6,9,"The Lord of the Rings, the Fellowship of the Ring",J.R.R. Tolkien,"Fantasy, Fiction",Random House Group Limited,2009
Digital,OverDrive,EBOOK,2018,6,2,"The Moffats: The Moffats Series, Book 1",Eleanor Estes,"Classic Literature, Juvenile Fiction",Houghton Mifflin Harcourt Trade and Reference,2011
Physical,Horizon,VIDEODISC,2018,6,7,Run Lola run / a Sony Pictures Classics release ; in association with Bavaria Film International of an X-Filme Creative Pool production ; produced by Stefan Arndt ; written and directed by Tom Tykwer.,,"Man woman relationships Drama, Running Drama, Feature films, Thrillers Motion pictures, Fiction films, Motion pictures German, Video recordings for the hearing impaired","Columbia TriStar Home Video,",[1999]
Digital,OverDrive,EBOOK,2018,6,9,"Breaking Dawn: The Twilight Saga, Book 4",Stephenie Meyer,"Fantasy, Romance, Young Adult Fiction","Hachette Digital, Inc.",2009
Digital,OverDrive,EBOOK,2018,6,1,"TBH #2: TBH, This May Be TMI",Lisa Greenwald,"Juvenile Fiction, Juvenile Literature",HarperCollins Publishers Inc.,2018
Physical,Horizon,VIDEODISC,2018,6,14,"The maze runner / Twentieth Century Fox ; a Gotham Group/Temple Hill production ; produced by Ellen Goldsmith-Vein, Wyck Godfrey, Marty Bowen, Lee Stollman ; directed by Wes Ball ; screenplay by Noah Oppenheim and Grant Pierce Myers and T.S. Nowlin.",,"Amnesia Drama, Cooperativeness Drama, Labyrinths Drama, Feature films, Fiction films, Action and adventure films, Science fiction films, Video recordings for the hearing impaired, Video recordings for people with visual disabilities","20th Century Fox Home Entertainment,",[2014]
Digital,OverDrive,EBOOK,2018,6,2,"Darkness Unbound: Dark Angels Series, Book 1",Keri Arthur,"Fantasy, Fiction, Romance","Random House, Inc.",2011
Physical,Horizon,BOOK,2018,6,3,"Cézanne portraits / John Elderfield ; with Mary Morton, Xavier Rey ; contributions by Alex Danchev, Jayne S. Warman.","Elderfield, John","C‚zanne Paul 1839 1906 Exhibitions, C‚zanne Paul 1839 1906 Criticism and interpretation, Painters France 19th century, Portrait painting French 19th century Exhibitions","Princeton University Press,",[2017]
Physical,Horizon,BOOK,2018,6,9,The picnic : matching shapes / by Lynn Maslen Kertell ; pictures by Sue Hendra and John R. Maslen.,"Kertell, Lynn Maslen.","Reading Preschool Juvenile literature, Shapes Juvenile literature, Readers, Pattern perception Juvenile literature","Scholastic,",[2008]
Physical,Horizon,BOOK,2018,6,7,Elephant in the dark : based on a poem by Rumi / retold by Mina Javaherbin ; pictures by Eugene Yelchin.,"Javaherbin, Mina","Jalal al Din Rumi Maulana 1207 1273 Adaptations, Blind men and the elephant Adaptations, Elephants Folklore Juvenile fiction, Perception Juvenile fiction, Folklore India Juvenile fiction, Fables, Perception Folklore","Scholastic Press,",2015.
Physical,Horizon,BOOK,2018,6,1,"Reading life, writing fiction : an introduction to novels by American women, 1920-1940 / Richard Martin.","Martin, Richard, 1934-","American fiction Women authors History and criticism, American fiction 20th century History and criticism, Women and literature United States History 20th century","P. Lang,",1994.
Physical,Horizon,BOOK,2018,6,2,The elves and the shoemaker : a folk tale classic / retold and illustrated by Paul Galdone.,"Galdone, Paul","Elves Juvenile fiction, Shoemakers Juvenile fiction, Folklore Germany Juvenile fiction, Tales Germany Juvenile literature, Fairy tales, Fairy tales","Houghton Mifflin Harcourt,",[2015]
Physical,Horizon,BOOK,2018,6,4,Skyscrapers / Libby Romero.,"Romero, Libby",Skyscrapers Juvenile literature,"National Geographic Children's Books,",[2017]
Physical,Horizon,BOOK,2018,6,1,The dangerous ladies affair / Marcia Muller and Bill Pronzini.,"Muller, Marcia","Carpenter Sabina Fiction, Quincannon John Fiction, Private investigators California San Francisco Fiction, Women detectives California San Francisco Fiction, Large type books, Detective and mystery fiction","Thorndike Press,",2017.
Physical,Horizon,BOOK,2018,6,1,River of dark dreams : slavery and empire in the cotton kingdom / Walter Johnson.,"Johnson, Walter, 1967-","Slavery Mississippi River Valley History 19th century, Cotton growing Mississippi River Valley History 19th century, Slavery Economic aspects Mississippi River Valley History 19th century, Capitalism Mississippi River Valley History 19th century, Social change Mississippi River Valley History 19th century, Imperialism History 19th century, Slave trade History 19th century, Mississippi River Valley Race relations History 19th century, Mississippi River Valley Commerce History 19th century, United States Territorial expansion History 19th century","Belknap Press of Harvard University Press,",2013.
Physical,Horizon,SOUNDDISC,2018,6,6,Pimsleur language programs. Spanish (Latin American) III A : the complete course.,,"Spanish language Sound recordings for English speakers, Spanish language Self instruction, Spanish language Study and teaching","Simon and Schuster Audio [producer] ; Recorded Books [distributor],",cp1998.
Physical,Horizon,SOUNDDISC,2018,6,3,Construction time again / Depeche Mode.,Depeche Mode (Musical group),"Popular music 1981 1990, Rock music 1981 1990","Sire/Rhino,",[1983]
Digital,OverDrive,AUDIOBOOK,2018,6,4,Truth & Beauty: A Friendship (unabridged) (Unabridged),Ann Patchett,"Biography & Autobiography, Nonfiction, Women's Studies",HarperCollins Publishers Inc.,2005
Physical,Horizon,BOOK,2018,6,5,How to get your teacher ready / by Jean Reagan ; illustrated by Lee Wildish.,"Reagan, Jean, 1965-","Elementary schools Juvenile fiction, Teachers Juvenile fiction, Human behavior Juvenile fiction, Helping behavior Juvenile fiction, Schools Fiction, Helpfulness Fiction, Picture books","Alfred A. Knopf,",[2017].
Physical,Horizon,VIDEODISC,2018,6,3,Two and a half men. The complete seventh season / Warner Bros. Television ; Chuck Lorre Productions ; The Tannenbaum Company ; directed by James Widdoes.,,"Brothers California Drama, Fathers and sons California Drama, Men Sexual behavior California Drama, Fiction television programs, Television series, Television comedies, Video recordings for the hearing impaired","Warner Home Video,",2010.
